### ISSUE TITLE
hep.lua can't apply in wireshark 4.xx

### ISSUE THREAD

**Issue by coolg92003** [sipcapture/hep-wireshark#19]
It has below error when reload hep.lua
tshark.exe -X lua_script:C:\other_softwares\wireshark\plugins\data\hep.lua -r C:\2_cfx_data\4.3_SBC_CN_2020\CN_feature\5G\5G_vTap\discussion_req\HEPv3\pcf_vtap_msg.pcap
tshark: Lua: Error during loading:
C:\other_softwares\wireshark\plugins\data\hep.lua:26: bad argument #2 to 'Proto' (Proto_new: there cannot be two protocols with the same description)
stack traceback:
        [C]: in function 'Proto'
        C:\other_softwares\wireshark\plugins\data\hep.lua:26: in main chunk
    1   0.000000   0.000000 192.168.10.120 → 192.168.10.157 TCP 56245 9999 2268 56245 → 9999 [PSH, ACK] Seq=2188381990 Ack=2948245407 Win=210 Len=2200 TSval=2872706371 TSecr=1825793670
    2   0.000034   0.000034 192.168.10.157 → 192.168.10.120 TCP 9999 56245 68 9999 → 56245 [ACK] Seq=2948245407 Ack=2188384190 Win=70 Len=0 TSval=1826216999 TSecr=2872706371
    3   1.000418   1.000418 192.168.10.120 → 192.168.10.157 TCP 56245 9999 1902 56245 → 9999 [PSH, ACK] Seq=2188384190 Ack=2948245407 Win=210 Len=1834 TSval=2872707372 TSecr=1826216999
    4   1.000603   1.000603 192.168.10.157 → 192.168.10.120 TCP 9999 56245 68 9999 → 56245 [ACK] Seq=2948245407 Ack=2188386024 Win=74 Len=0 TSval=1826218000 TSecr=2872707372
    5   2.001466   2.001466 192.168.10.120 → 192.168.10.157 TCP 56245 9999 1902 56245 → 9999 [PSH, ACK] Seq=2188386024 Ack=2948245407 Win=210 Len=1834 TSval=2872708373 TSecr=1826218000
    6   2.001503   2.001503 192.168.10.157 → 192.168.10.120 TCP 9999 56245 68 9999 → 56245 [ACK] Seq=2948245407 Ack=2188387858 Win=77 Len=0 TSval=1826219001 TSecr=2872708373
    7   3.018744   3.018744 192.168.10.120 → 192.168.10.157 TCP 56245 9999 1902 56245 → 9999 [PSH, ACK] Seq=2188387858 Ack=2948245407 Win=210 Len=1834 TSval=2872709391 TSecr=1826219001
    8   3.018787   3.018787 192.168.10.157 → 192.168.10.120 TCP 9999 56245 68 9999 → 56245 [ACK] Seq=2948245407 Ack=2188389692 Win=81 Len=0 TSval=1826220018 TSecr=2872709391
    9   4.019528   4.019528 192.168.10.120 → 192.168.10.157 TCP 56245 9999 1902 56245 → 9999 [PSH, ACK] Seq=2188389692 Ack=2948245407 Win=210 Len=1834 TSval=2872710392 TSecr=1826220018
   10   4.019958   4.019958 192.168.10.157 → 192.168.10.120 TCP 9999 56245 68 9999 → 56245 [ACK] Seq=2948245407 Ack=2188391526 Win=85 Len=0 TSval=1826221019 TSecr=2872710392
   11   5.020458   5.020458 192.168.10.120 → 192.168.10.157 TCP 56245 9999 1902 56245 → 9999 [PSH, ACK] Seq=2188391526 Ack=2948245407 Win=210 Len=1834 TSval=2872711393 TSecr=1826221019

there is no error in wireshark 3.xx
thanks
Cliff

**Comment by adubovikov** [comment]
Thank you - we will check

**Comment by adubovikov** [comment]
Can you please validate if it works for you now ?

**Comment by coolg92003** [comment]
Hi @adubovikov ,
Really appreciated your quick response!
**There is No any load error now.**

However, the official hep.lua still can't decode my pcap because of my TCP port is 9999.
even if I add below changes
```
tcp_table = DissectorTable.get("tcp.port")
tcp_table:add(9060, hep_proto)
tcp_table:add(9062, hep_proto)

+++ tcp_table:add(9999, hep_proto)

```
current, I am still trying to find why.
my current workaround in my test env is to use the port 9060, then it can decode HEP message.

nice day!
thanks
Cliff

**Comment by coolg92003** [comment]
hi @adubovikov ,
I find the issue answer.
the major reason is that the port 9999 is used for other protocol.
it is needed to be removed firstly, then it can decode 9999 for hep.
No issue now and appreciated your great work!
Nice day!
Cliff
